{
  "accountId": "accountId",
  "customIdentifierFields": {},
  "vendorId": "vendorId",
  "callbackData": {},
  "subAccountId": "subAccountId",
  "branchId": "branchId",
  "items": [
    {
      "itemId": "itemId",
      "quantity": 0.0
    }
  ],
  "shippingAddress": null,
  "isVendorCounterPickup": false
}